chapter_id,chapter_name,section_id,section_name,req_id,req_description,level1,level2,level3,cwe,nist
V1,,V1.1,Ciclo de Vida de Desarrollo de Software Seguro,V1.1.1,Verifique el uso de un ciclo de vida de desarrollo de software seguro que aborde la seguridad en todas las etapas del desarrollo. ([C1](https://owasp.org/www-project-proactive-controls/#div-numbering)),,✓,✓,,
V1,,V1.1,Ciclo de Vida de Desarrollo de Software Seguro,V1.1.2,"Verifique el uso del modelado de amenazas para cada cambio de diseño o planificación de sprint para identificar amenazas, planificar contramedidas, facilitar respuestas de riesgo adecuadas y guiar las pruebas de seguridad.",,✓,✓,1053,
V1,,V1.1,Ciclo de Vida de Desarrollo de Software Seguro,V1.1.3,"Verifique que todas las historias y características de usuario contienen restricciones de seguridad funcionales, como por ejemplo: ""Como usuario, debería poder ver y editar mi perfil. No debería ser capaz de ver o editar el perfil de nadie más""",,✓,✓,1110,
V1,,V1.1,Ciclo de Vida de Desarrollo de Software Seguro,V1.1.4,"Verifique la documentación y la justificación de todos los límites de confianza, componentes y flujos de datos significativos de la aplicación.",,✓,✓,1059,
V1,,V1.1,Ciclo de Vida de Desarrollo de Software Seguro,V1.1.5,Verifique la definición y el análisis de seguridad de la arquitectura de alto nivel de la aplicación y todos los servicios remotos conectados. ([C1](https://owasp.org/www-project-proactive-controls/#div-numbering)),,✓,✓,1059,
V1,,V1.1,Ciclo de Vida de Desarrollo de Software Seguro,V1.1.6,"Verifique la implementación de controles de seguridad centralizados, simples (economía del diseño), comprobados, seguros y reutilizables para evitar controles duplicados, faltantes, ineficaces o inseguros. ([C10](https://owasp.org/www-project-proactive-controls/#div-numbering))",,✓,✓,637,
V1,,V1.1,Ciclo de Vida de Desarrollo de Software Seguro,V1.1.7,"Verifique la disponibilidad de una lista de comprobación de codificación segura, requisitos de seguridad, directriz o directiva para todos los desarrolladores y evaluadores.",,✓,✓,637,
V1,,V1.2,Arquitectura de Autenticación,V1.2.1,"Verifique el uso de cuentas de sistema operativo únicas o especiales con privilegios bajos para todos los componentes, servicios y servidores de la aplicación. ([C3](https://owasp.org/www-project-proactive-controls/#div-numbering))",,✓,✓,250,
V1,,V1.2,Arquitectura de Autenticación,V1.2.2,"Verifique que las comunicaciones entre los componentes de la aplicación, incluidas las API, el middleware y las capas de datos, se autentican. Los componentes deben tener los mínimos privilegios necesarios. ([C3](https://owasp.org/www-project-proactive-controls/#div-numbering))",,✓,✓,306,
V1,,V1.2,Arquitectura de Autenticación,V1.2.3,"Verifique que la aplicación utiliza un único mecanismo de autenticación comprobado que se sabe que es seguro, se puede ampliar para incluir una autenticación segura y tiene suficiente logging y supervisión para detectar abuso de cuenta o brechas.",,✓,✓,306,
V1,,V1.2,Arquitectura de Autenticación,V1.2.4,"Verifique que todas las vías de autenticación y las API de administración de identidades implementan una fortaleza coherente del control de seguridad de autenticación, de modo que no haya alternativas más débiles por el riesgo de la aplicación.",,✓,✓,306,
V1,,V1.4,Arquitectura de Control de Acceso,V1.4.1,"Verifique que los puntos de cumplimiento de confianza, tales como puertas de enlace de control de acceso, servidores y funciones serverless, exijan controles de acceso. Nunca aplique controles de acceso en el cliente.",,✓,✓,602,
V1,,V1.4,Arquitectura de Control de Acceso,V1.4.2,"[ELIMINADO, NO ACCIONABLE]",,,,,
V1,,V1.4,Arquitectura de Control de Acceso,V1.4.3,"[ELIMINADO, DUPLICADO CON 4.1.3]",,,,,
V1,,V1.4,Arquitectura de Control de Acceso,V1.4.4,Verifique que la aplicación utilice un mecanismo de control de acceso único y bien comprobado para acceder a datos y recursos protegidos. Todas las solicitudes deben pasar por este único mecanismo para evitar copiar y pegar o rutas alternativas inseguras. ([C7](https://owasp.org/www-project-proactive-controls/#div-numbering)),,✓,✓,284,
V1,,V1.4,Arquitectura de Control de Acceso,V1.4.5,Verifique que se utiliza el control de acceso basado en atributos o entidades mediante el cual el código comprueba la autorización del usuario para un elemento de característica o datos en lugar de solo su rol. Los permisos deben asignarse mediante roles. ([C7](https://owasp.org/www-project-proactive-controls/#div-numbering)),,✓,✓,275,
V1,,V1.5,Arquitectura de Entradas y Salidas,V1.5.1,"Verifique que los requisitos de entrada y salida definan claramente cómo manejar y procesar datos en función del tipo, contenido y las leyes, regulaciones y otras leyes aplicables, reglamentos y otras normas de cumplimiento de políticas.",,✓,✓,1029,
V1,,V1.5,Arquitectura de Entradas y Salidas,V1.5.2,"Verifique que no se usa serialización al comunicarse con clientes que no son de confianza. Si esto no es posible, asegúrese de que se apliquen controles de integridad adecuados (y posiblemente cifrado si se envían datos confidenciales) para evitar ataques de deserialización, incluida la inyección de objetos.",,✓,✓,502,
V1,,V1.5,Arquitectura de Entradas y Salidas,V1.5.3,Verifique que la validación de datos de entrada (input) se aplica en una capa de servicio de confianza. ([C5](https://owasp.org/www-project-proactive-controls/#div-numbering)),,✓,✓,602,
V1,,V1.5,Arquitectura de Entradas y Salidas,V1.5.4,Verifique que la codificación de salida (output encode) se produce cerca o en el intérprete para el que está destinada. ([C4](https://owasp.org/www-project-proactive-controls/#div-numbering)),,✓,✓,116,
V1,,V1.6,Arquitectura Criptográfica,V1.6.1,Verifique que existe una política explícita para la administración de claves criptográficas y que un ciclo de vida de clave criptográfica sigue un estándar de administración de claves como NIST SP 800-57.,,✓,✓,320,
V1,,V1.6,Arquitectura Criptográfica,V1.6.2,Verifique que los consumidores de servicios criptográficos protegen el material clave y otros secretos mediante el uso de almacenes de claves o alternativas basadas en API.,,✓,✓,320,
V1,,V1.6,Arquitectura Criptográfica,V1.6.3,Verifique que todas las claves y contraseñas son reemplazables y forman parte de un proceso bien definido para volver a cifrar los datos confidenciales.,,✓,✓,320,
V1,,V1.6,Arquitectura Criptográfica,V1.6.4,"Verifique que la arquitectura trata los secretos del lado cliente (como claves simétricas, contraseñas o tokens de API) como inseguros y nunca los usa para proteger o acceder a datos confidenciales.",,✓,✓,320,
V1,,V1.7,"Arquitectura de Errores, Logging y Auditoría",V1.7.1,Verifique que se utilice un formato común y un enfoque de logging en todo el sistema. ([C9](https://owasp.org/www-project-proactive-controls/#div-numbering)),,✓,✓,1009,
V1,,V1.7,"Arquitectura de Errores, Logging y Auditoría",V1.7.2,"Verifique que los registros de log se transmitan de forma segura a un sistema preferentemente remoto para análisis, detección, alertas y escalamiento. ([C9](https://owasp.org/www-project-proactive-controls/#div-numbering))",,✓,✓,,
V1,,V1.8,Arquitectura de Protección de Datos y Privacidad,V1.8.1,Verifique que todos los datos confidenciales se identifiquen y clasifiquen en niveles de protección.,,✓,✓,,
V1,,V1.8,Arquitectura de Protección de Datos y Privacidad,V1.8.2,"Verifique que todos los niveles de protección tienen un conjunto asociado de requisitos de protección, como los requisitos de cifrado, los requisitos de integridad, la retención, la privacidad y otros requisitos de confidencialidad, y que estos se aplican en la arquitectura.",,✓,✓,,
V1,,V1.9,Arquitectura de Comunicaciones,V1.9.1,"Verifique que la aplicación cifra las comunicaciones entre componentes, especialmente cuando estos componentes se encuentran en contenedores, sistemas, sitios o proveedores de nube diferentes. ([C3](https://owasp.org/www-project-proactive-controls/#div-numbering))",,✓,✓,319,
V1,,V1.9,Arquitectura de Comunicaciones,V1.9.2,"Verifique que los componentes de la aplicación verifiquen la autenticidad de cada lado en un vínculo de comunicación para evitar ataques de ""persona en el medio"". Por ejemplo, los componentes de la aplicación deben validar certificados y cadenas TLS.",,✓,✓,295,
V1,,V1.10,Arquitectura de Software Malicioso,V1.10.1,"Verifique que un sistema de control de código fuente está en uso, con procedimientos para garantizar que los check-ins están respaldados tickets de issues o solicitudes de cambio. El sistema de control de código fuente debe tener control de acceso y usuarios identificables para permitir la trazabilidad de cualquier cambio.",,✓,✓,284,
V1,,V1.11,Arquitectura de la Lógica de Negocio,V1.11.1,Verifique la definición y documentación de todos los componentes de la aplicación en términos de las funciones de negocio o de seguridad que proporcionan.,,✓,✓,1059,
V1,,V1.11,Arquitectura de la Lógica de Negocio,V1.11.2,"Verifique que todos los flujos de lógica de negocio de alto valor, incluida la autenticación, la administración de sesiones y el control de acceso, no compartan estados no sincronizados.",,✓,✓,362,
V1,,V1.11,Arquitectura de la Lógica de Negocio,V1.11.3,"Verifique que todos los flujos de lógica de negocio de alto valor, incluida la autenticación, la administración de sesiones y el control de acceso, sean seguros para subprocesos y resistentes a condiciones de carrera time-of-check y time-of-use (race conditions).",,,✓,367,
V1,,V1.12,Arquitectura de Carga Segura de Archivos,V1.12.1,"[ELIMINADO, DUPLICADO CON 12.4.1]",,,,,
V1,,V1.12,Arquitectura de Carga Segura de Archivos,V1.12.2,"Verifique que los archivos subidos por el usuario, -si es necesario que se muestren o descarguen desde la aplicación-, se hace mediante descargas de secuencias de octetos o desde un dominio no relacionado, como un almacenamiento de archivos en la nube. Implemente una directiva de seguridad de contenido (CSP) adecuada para reducir el riesgo de vectores XSS u otros ataques desde el archivo cargado.",,✓,✓,646,
V1,,V1.14,Arquitectura de Configuración,V1.14.1,"Verifique la segregación de componentes de diferentes niveles de confianza a través de controles de seguridad bien definidos, reglas de corta fuego, pasarelas de API, proxies reversos, grupos de seguridad basados en nube, o mecanismos similares",,✓,✓,293,
V1,,V1.14,Arquitectura de Configuración,V1.14.2,"Verifique que las firmas binarias, las conexiones de confianza y los puntos de conexión verificados se usan para el despliegue de archivos binarios a dispositivos remotos.",,✓,✓,494,
V1,,V1.14,Arquitectura de Configuración,V1.14.3,Verifique que el canal de compilación advierte de componentes obsoletos o inseguros y realiza las acciones adecuadas.,,✓,✓,1104,
V1,,V1.14,Arquitectura de Configuración,V1.14.4,"Verifique que el canal de compilación contiene un paso para compilar y comprobar automáticamente el despliegue seguro de la aplicación, especialmente si la infraestructura de la aplicación está definida por software, como los scripts de compilación del entorno en la nube.",,✓,✓,,
V1,,V1.14,Arquitectura de Configuración,V1.14.5,"Verifique que los despliegues de aplicaciones sean en sandbox, contenedores y/o aislados a nivel de red para retrasar e impedir que los atacantes vulneren otras aplicaciones, especialmente cuando realizan acciones sensibles o peligrosas, como la deserialización. ([C5](https://owasp.org/www-project-proactive-controls/#div-numbering))",,✓,✓,265,
V1,,V1.14,Arquitectura de Configuración,V1.14.6,"Verifique que la aplicación no utiliza tecnologías del lado cliente no compatibles, inseguras o en desuso, como NSAPI plugins, Flash, Shockwave, ActiveX, Silverlight, NACL o client-side java applets.",,✓,✓,477,
V2,,V2.1,Seguridad de Contraseña,V2.1.1,Verifique que las contraseñas del usuarios tienen al menos 12 caracteres de longitud (después de combinar varios espacios). ([C6](https://owasp.org/www-project-proactive-controls/#div-numbering)),✓,✓,✓,521,5.1.1.2
V2,,V2.1,Seguridad de Contraseña,V2.1.2,Verifique que se permitan contraseñas de al menos 64 caracteres y que se denieguen contraseñas de más de 128 caracteres. ([C6](https://owasp.org/www-project-proactive-controls/#div-numbering)),✓,✓,✓,521,5.1.1.2
V2,,V2.1,Seguridad de Contraseña,V2.1.3,"Verifique que no se realiza el truncamiento de contraseña. Sin embargo, varios espacios consecutivos pueden ser reemplazados por un solo espacio. ([C6](https://owasp.org/www-project-proactive-controls/#div-numbering))",✓,✓,✓,521,5.1.1.2
V2,,V2.1,Seguridad de Contraseña,V2.1.4,"Verifique que cualquier carácter Unicode imprimible, incluidos los caracteres neutros del idioma, como espacios y Emojis esté permitido en las contraseñas.",✓,✓,✓,521,5.1.1.2
V2,,V2.1,Seguridad de Contraseña,V2.1.5,Verifique que los usuarios pueden cambiar su contraseña.,✓,✓,✓,620,5.1.1.2
V2,,V2.1,Seguridad de Contraseña,V2.1.6,Verifique que la funcionalidad de cambio de contraseña requiere la contraseña actual y nueva del usuario.,✓,✓,✓,620,5.1.1.2
V2,,V2.1,Seguridad de Contraseña,V2.1.7,"Verifique que las contraseñas enviadas durante el registro de la cuenta, el inicio de sesión y el cambio de contraseña se comprueban localmente contra un conjunto de contraseñas filtradas (como las 1,000 o 10,000 contraseñas más comunes que coinciden con la directiva de contraseñas del sistema) o mediante una API externa. Si se utiliza una API, una prueba de zero knowledge u otro mecanismo, asegúrese que la contraseña en texto plano no se envía ni se utiliza para verificar el estado de filtración de la contraseña. Si la contraseña esta filtrada, la aplicación debe exigir al usuario que establezca una nueva contraseña no filtrada. ([C6](https://owasp.org/www-project-proactive-controls/#div-numbering))",✓,✓,✓,521,5.1.1.2
V2,,V2.1,Seguridad de Contraseña,V2.1.8,Verifique que se proporciona un medidor de fortaleza de la contraseña para ayudar a los usuarios a establecer una contraseña más segura.,✓,✓,✓,521,5.1.1.2
V2,,V2.1,Seguridad de Contraseña,V2.1.9,Verifique que no hay reglas de composición de contraseñas que limiten el tipo de caracteres permitidos. No debe haber ningún requisito para mayúsculas o minúsculas o números o caracteres especiales. ([C6](https://owasp.org/www-project-proactive-controls/#div-numbering)),✓,✓,✓,521,5.1.1.2
V2,,V2.1,Seguridad de Contraseña,V2.1.10,Verifique que no haya rotación periódica de credenciales o solicitud del historial de contraseñas.,✓,✓,✓,263,5.1.1.2
V2,,V2.1,Seguridad de Contraseña,V2.1.11,"Verifique que se permite la funcionalidad ""pegar"", las aplicaciones auxiliares de contraseñas del browser y los administradores externos de contraseñas.",✓,✓,✓,521,5.1.1.2
V2,,V2.1,Seguridad de Contraseña,V2.1.12,Verifique que el usuario puede elegir entre ver temporalmente toda la contraseña enmascarada o ver temporalmente el último caracter escrito de la contraseña en plataformas que no tienen esto como funcionalidad integrada.,✓,✓,✓,521,5.1.1.2
V2,,V2.2,Seguridad General del Autenticador,V2.2.1,"Verifique que los controles anti-automatización son efectivos para mitigar las pruebas de credenciales filtradas, fuerza bruta y ataques de bloqueo de cuentas. Estos controles incluyen el bloqueo de las contraseñas filtradas más comunes, bloqueos suaves, limitación de velocidad, CAPTCHA, retrasos cada vez mayores entre intentos, restricciones de direcciones IP o restricciones basadas en riesgos, como la ubicación, el primer inicio de sesión en un dispositivo, los intentos recientes de desbloquear la cuenta o similares. Verifique que no sea posible realizar más de 100 intentos fallidos por hora en una sola cuenta.",✓,✓,✓,307,5.2.2 / 5.1.1.2 / 5.1.4.2 / 5.1.5.2
V2,,V2.2,Seguridad General del Autenticador,V2.2.2,"Verifique que el uso de autenticadores débiles (como SMS y correo electrónico) se limita a la verificación secundaria y la aprobación de transacciones y no como un reemplazo para métodos de autenticación más seguros. Verifique que se ofrezcan métodos más fuertes y no métodos débiles, que los usuarios sean conscientes de los riesgos o que se tomen las medidas adecuadas para limitar los riesgos de compromiso de la cuenta.",✓,✓,✓,304,5.2.10
V2,,V2.2,Seguridad General del Autenticador,V2.2.3,"Verifique que las notificaciones seguras se envían a los usuarios después de las actualizaciones de los detalles de autenticación, como restablecimientos de credenciales, cambios de correo electrónico o dirección, inicio de sesión desde ubicaciones desconocidas o de riesgo. Se prefiere el uso de notificaciones push - en lugar de SMS o correo electrónico - , pero en ausencia de notificaciones push, SMS o correo electrónico es aceptable siempre y cuando no se divulgue información confidencial en la notificación.",✓,✓,✓,620,
V2,,V2.2,Seguridad General del Autenticador,V2.2.4,"Verifique la resistencia a la suplantación contra el phishing, como el uso de la autenticación multifactor, los dispositivos criptográficos con intención (como las claves conectadas con un push para autenticarse) o en niveles AAL más altos, certificados del lado cliente.",,,✓,308,5.2.5
V2,,V2.2,Seguridad General del Autenticador,V2.2.5,"Verifique que donde se separan un proveedor de servicios de credenciales (CSP) y la aplicación que comprueba la autenticación, el TLS mutuamente autenticado está en su lugar entre los dos endpoints.",,,✓,319,5.2.6
V2,,V2.2,Seguridad General del Autenticador,V2.2.6,"Verifique la resistencia a la reproducción mediante el uso obligatorio de dispositivos de one-time password (OTP), autenticadores criptográficos o códigos de búsqueda.",,,✓,308,5.2.8
V2,,V2.2,Seguridad General del Autenticador,V2.2.7,"Verifique la intención de autenticarse exigiendo la entrada de un token de OTP o una acción iniciada por el usuario, como una pulsación de botón en un teclado de hardware FIDO.",,,✓,308,5.2.9
V2,,V2.3,Ciclo de Vida del Autenticador,V2.3.1,"Verifique que las contraseñas iniciales o los códigos de activación generados por el sistema DEBEN ser generados de forma aleatoreamente segura, DEBE tener al menos 6 caracteres de largo y PUEDE contener letras y números, y expirar después de un corto período de tiempo. Estos secretos iniciales no deben permitirse su re-utilización para convertirse en la contraseña a largo plazo.",✓,✓,✓,330,5.1.1.2 / A.3
V2,,V2.3,Ciclo de Vida del Autenticador,V2.3.2,"Verifique que se admite la inscripción y el uso de dispositivos de autenticación proporcionados por el suscriptor, como tokens U2F o FIDO.",,✓,✓,308,6.1.3
V2,,V2.3,Ciclo de Vida del Autenticador,V2.3.3,Verifique que las instrucciones de renovación se envían con tiempo suficiente para renovar los autenticadores con límite de tiempo.,,✓,✓,287,6.1.4
V2,,V2.4,Almacenamiento de Credenciales,V2.4.1,"Verifique que las contraseñas se almacenan en un forma tal que resisten ataques sin conexión. Las contraseñas *DEBERÁN* usar hash con `salto` mediante una derivación de llave de una sola vía aprobada o función de hash de contraseña. Las funciones derivación de llave y hash de contraseñas toman una contraseña, una salto y un factor de costo como entradas al generar un hash de contraseña. ([C6](https://owasp.org/www-project-proactive-controls/#div-numbering))",,✓,✓,916,5.1.1.2
V2,,V2.4,Almacenamiento de Credenciales,V2.4.2,"Verifique que el salto tiene al menos 32 bits de longitud y que se elige arbitrariamente para minimizar las colisiones de valor de salto entre los hashes almacenados. Para cada credencial, se *DEBE* almacenar un único valor de salto y el hash resultante. ([C6](https://owasp.org/www-project-proactive-controls/#div-numbering))",,✓,✓,916,5.1.1.2
V2,,V2.4,Almacenamiento de Credenciales,V2.4.3,"Verifique que si se utiliza PBKDF2, el recuento de iteraciones DEBE ser tan grande como el rendimiento del servidor de verificación lo permita, normalmente de al menos 100,000 iteraciones. ([C6](https://owasp.org/www-project-proactive-controls/#div-numbering))",,✓,✓,916,5.1.1.2
V2,,V2.4,Almacenamiento de Credenciales,V2.4.4,"Verifique que si se utiliza bcrypt, el factor de trabajo DEBE ser tan grande como lo permita el rendimiento del servidor de verificación, con un mínimo de 10. ([C6](https://owasp.org/www-project-proactive-controls/#div-numbering))",,✓,✓,916,5.1.1.2
V2,,V2.4,Almacenamiento de Credenciales,V2.4.5,"Verifique que se realiza una iteración adicional de una función de derivación de claves, utilizando un valor de salto que es secreto y que solo conoce el verificador. Genere el valor de salto utilizando un generador de bits aleatorios aprobado [SP 800-90Ar1] y proporcione al menos la fuerza de seguridad mínima especificada en la última revisión del SP 800-131A. El valor secreto del salto se almacenará por separado de las contraseñas hash (p. ej., en un dispositivo especializado como un módulo de seguridad de hardware).",,✓,✓,916,5.1.1.2
V2,,V2.5,Recuperación de Credenciales,V2.5.1,Verifique que un secreto de activación o recuperación inicial generado por el sistema no se envíe en texto claro al usuario. ([C6](https://owasp.org/www-project-proactive-controls/#div-numbering)),✓,✓,✓,640,5.1.1.2
V2,,V2.5,Recuperación de Credenciales,V2.5.2,"Verificar sugerencias de contraseña o autenticación basada en conocimientos (las llamadas ""preguntas secretas"") no están presentes.",✓,✓,✓,640,5.1.1.2
V2,,V2.5,Recuperación de Credenciales,V2.5.3,Verificar la recuperación de credenciales de contraseña no revela la contraseña actual de ninguna manera. ([C6](https://owasp.org/www-project-proactive-controls/#div-numbering)),✓,✓,✓,640,5.1.1.2
V2,,V2.5,Recuperación de Credenciales,V2.5.4,"Verificar que las cuentas compartidas o predeterminadas no estén presentes (por ejemplo. ""root"", ""admin"", o ""sa"").",✓,✓,✓,16,5.1.1.2 / A.3
V2,,V2.5,Recuperación de Credenciales,V2.5.5,"Verifique que si se cambia o reemplaza un factor de autenticación, se notifica al usuario de este evento.",✓,✓,✓,304,6.1.2.3
V2,,V2.5,Recuperación de Credenciales,V2.5.6,"Verifique la contraseña olvidada y otras rutas de recuperación utilizan un mecanismo de recuperación seguro, como OTP basado en el tiempo (TOTP) u otro token de software, mobile push u otro mecanismo de recuperación sin conexión. ([C6](https://owasp.org/www-project-proactive-controls/#div-numbering))",✓,✓,✓,640,5.1.1.2
V2,,V2.5,Recuperación de Credenciales,V2.5.7,"Verifique que si se pierden factores de autenticación OTP o multifactor, esa evidencia de prueba de identidad se realiza al mismo nivel que durante la inscripción.",,✓,✓,308,6.1.2.3
V2,,V2.6,Verificador de Secretos de Look-up,V2.6.1,Verifique que los secretos de búsqueda solo se pueden usar una vez.,,✓,✓,308,5.1.2.2
V2,,V2.6,Verificador de Secretos de Look-up,V2.6.2,"Verifique que los secretos de búsqueda tengan suficiente aleatoriedad (112 bits de entropía), o si menos de 112 bits de entropía, saltados con un única y aleatoria salto de 32 bits y hasheado con un hash aprobado de una sola vía.",,✓,✓,330,5.1.2.2
V2,,V2.6,Verificador de Secretos de Look-up,V2.6.3,"Verifique que los secretos de búsqueda son resistentes a los ataques sin conexión, como los valores predecibles.",,✓,✓,310,5.1.2.2
V2,,V2.7,Verificador Fuera de Banda,V2.7.1,"Verifique que los autenticadores de texto sin cifrar fuera de banda tales como PSTN o SMS (""restringido por NIST"") no se ofrecen de forma predeterminada, y que en primer lugar se ofrecen alternativas más sólidas, como las notificaciones push.",✓,✓,✓,287,5.1.3.2
V2,,V2.7,Verificador Fuera de Banda,V2.7.2,"Verifique que el verificador fuera de banda expira después de 10 minutos, fuera de las solicitudes de autenticación de banda, códigos o tokens.",✓,✓,✓,287,5.1.3.2
V2,,V2.7,Verificador Fuera de Banda,V2.7.3,"Verifique que las solicitudes de autenticación, los códigos o los tokens de verificador fuera de banda solo se pueden usar una vez y solo para la solicitud de autenticación original.",✓,✓,✓,287,5.1.3.2
V2,,V2.7,Verificador Fuera de Banda,V2.7.4,Verifique que el autenticador y el verificador fuera de banda se comuniquen a través de un canal independiente seguro.,✓,✓,✓,523,5.1.3.2
V2,,V2.7,Verificador Fuera de Banda,V2.7.5,Verifique que el verificador fuera de banda conserva solo una versión hasheada del código de autenticación.,,✓,✓,256,5.1.3.2
V2,,V2.7,Verificador Fuera de Banda,V2.7.6,"Verifique que el código de autenticación inicial sea generado por un generador de números aleatorios seguro, que contiene al menos 20 bits de entropía (normalmente un número aleatorio digital de seis es suficiente).",,✓,✓,310,5.1.3.2
V2,,V2.8,Verificador de Una Sola Vez,V2.8.1,Verifique que los OTP basados en el tiempo tienen una duración definida antes de expirar.,✓,✓,✓,613,5.1.4.2 / 5.1.5.2
V2,,V2.8,Verificador de Una Sola Vez,V2.8.2,"Verifique que las claves simétricas utilizadas para comprobar los OTP enviados están altamente protegidas, por ejemplo, mediante el uso de un módulo de seguridad de hardware o almacenamiento seguro de claves basadas en el sistema operativo.",,✓,✓,320,5.1.4.2 / 5.1.5.2
V2,,V2.8,Verificador de Una Sola Vez,V2.8.3,"Verifique que los algoritmos criptográficos aprobados se utilizan en la generación, siembra y verificación de OTP.",,✓,✓,326,5.1.4.2 / 5.1.5.2
